{
  "$schema": "https://json-schema.org/draft/2020-12/schema",
  "$id": "https://aidocs.local/schemas/document-v1.json",
  "title": "Document v1",
  "type": "object",
  "required": ["schema_version", "type", "cover", "style", "chapters"],
  "additionalProperties": false,
  "properties": {
    "schema_version": { "const": 1 },
    "type": { "enum": ["makalah", "laporan_praktikum", "laporan_pkl", "proposal"] },
    "cover": {
      "type": "object",
      "required": ["title"],
      "additionalProperties": false,
      "properties": {
        "title": { "type": "string", "minLength": 1 },
        "name": { "type": "string" },
        "nim": { "type": "string" },
        "prodi": { "type": "string" },
        "campus": { "type": "string" },
        "year": { "type": "string" }
      }
    },
    "style": { "enum": ["formal", "semi_formal", "ringkas"] },
    "chapters": { "type": "array", "items": { "$ref": "#/$defs/chapter" } },
    "references": {
      "type": "array",
      "items": {
        "type": "object",
        "required": ["id", "text"],
        "additionalProperties": false,
        "properties": {
          "id": { "$ref": "#/$defs/id" },
          "text": { "type": "string", "minLength": 1 }
        }
      }
    },
    "sources": {
      "type": "array",
      "items": {
        "type": "object",
        "required": ["id", "text"],
        "additionalProperties": false,
        "properties": {
          "id": { "$ref": "#/$defs/id" },
          "text": { "type": "string", "minLength": 1 },
          "url": { "type": ["string", "null"] },
          "doi": { "type": ["string", "null"] }
        }
      }
    },
    "style_citation": { "enum": ["apa", "ieee", "harvard"] },
    "abstract": { "type": "string", "maxLength": 1500 },
    "appendices": {
      "type": "array",
      "items": {
        "type": "object",
        "required": ["id", "title", "text"],
        "additionalProperties": false,
        "properties": {
          "id": { "$ref": "#/$defs/id" },
          "title": { "type": "string", "minLength": 1, "maxLength": 200 },
          "text": { "type": "string", "minLength": 1 }
        }
      }
    },
    "options": {
      "type": "object",
      "additionalProperties": false,
      "properties": {
        "approval_page": { "type": "boolean" },
        "abstract": { "type": "boolean" },
        "appendices": { "type": "boolean" }
      }
    },
    "brief": {
      "type": "object",
      "additionalProperties": false,
      "properties": {
        "input": { "enum": ["paste", "topic", "upload"] },
        "upload_path": { "type": "string" },
        "outline_approved_at": { "type": "string" },
        "section_notes": { "type": "object", "additionalProperties": { "type": "string" } },
        "topic": { "type": "string" },
        "chapter_count": { "type": "integer", "minimum": 3, "maximum": 7 },
        "length": { "enum": ["ringkas", "sedang", "panjang"] },
        "instructions": { "type": "string", "maxLength": 500 },
        "raw_text": { "type": "string" },
        "paragraphs": {
          "type": "array",
          "items": {
            "type": "object",
            "required": ["id", "text"],
            "additionalProperties": false,
            "properties": {
              "id": { "type": "string", "pattern": "^p[1-9][0-9]*$" },
              "text": { "type": "string" }
            }
          }
        },
        "facts": {
          "anyOf": [
            { "type": "array", "maxItems": 0 },
            { "type": "object", "maxProperties": 0 },
            { "$ref": "#/$defs/praktikum_facts" },
            { "$ref": "#/$defs/pkl_facts" }
          ]
        }
      }
    }
  },
  "$defs": {
    "fact_text": { "type": "string", "minLength": 1 },
    "fact_list": { "type": "array", "minItems": 1, "items": { "$ref": "#/$defs/fact_text" } },
    "praktikum_facts": {
      "type": "object",
      "required": ["experiment_title", "objective", "materials", "steps", "observations"],
      "additionalProperties": false,
      "properties": {
        "experiment_title": { "$ref": "#/$defs/fact_text" },
        "objective": { "$ref": "#/$defs/fact_text" },
        "materials": { "$ref": "#/$defs/fact_list" },
        "steps": { "$ref": "#/$defs/fact_list" },
        "observations": { "$ref": "#/$defs/fact_text" }
      }
    },
    "pkl_facts": {
      "type": "object",
      "required": ["institution", "division", "period", "activities"],
      "additionalProperties": false,
      "properties": {
        "institution": { "$ref": "#/$defs/fact_text" },
        "division": { "$ref": "#/$defs/fact_text" },
        "period": { "$ref": "#/$defs/fact_text" },
        "activities": { "$ref": "#/$defs/fact_list" }
      }
    },
    "id": { "type": "string", "format": "uuid" },
    "heading": {
      "type": "string",
      "minLength": 1,
      "pattern": "^(?!\\s*(?:BAB\\b|\\d+(?:\\.\\d+)+\\.?\\s|\\d+[.)]\\s))"
    },
    "chapter": {
      "type": "object",
      "required": ["id", "title", "sections"],
      "additionalProperties": false,
      "properties": {
        "id": { "$ref": "#/$defs/id" },
        "title": { "$ref": "#/$defs/heading" },
        "sections": { "type": "array", "items": { "$ref": "#/$defs/section" } }
      }
    },
    "section": {
      "type": "object",
      "required": ["id", "title", "blocks"],
      "additionalProperties": false,
      "properties": {
        "id": { "$ref": "#/$defs/id" },
        "title": { "$ref": "#/$defs/heading" },
        "blocks": { "type": "array", "items": { "$ref": "#/$defs/block" } }
      }
    },
    "block": {
      "oneOf": [
        {
          "type": "object",
          "required": ["id", "type", "text"],
          "additionalProperties": false,
          "properties": {
            "id": { "$ref": "#/$defs/id" },
            "type": { "const": "paragraph" },
            "text": { "type": "string" }
          }
        },
        {
          "type": "object",
          "required": ["id", "type", "ordered", "items"],
          "additionalProperties": false,
          "properties": {
            "id": { "$ref": "#/$defs/id" },
            "type": { "const": "list" },
            "ordered": { "type": "boolean" },
            "items": { "type": "array", "minItems": 1, "items": { "type": "string" } }
          }
        }
      ]
    }
  }
}
